{
  "$schema": "../spec/scenario-fixtures.schema.json",
  "schema_version": 1,
  "kind": "agp_scenario_fixtures",
  "contract_files": [
    "Installer/spec/release-manifest.schema.json",
    "Installer/spec/install-state.schema.json",
    "Installer/spec/install-journal.schema.json",
    "Installer/spec/state-transitions.json",
    "Installer/spec/package-layout.json",
    "Installer/spec/compatibility-evidence.schema.json"
  ],
  "scenarios": [
    {
      "id": "known-clean-install",
      "description": "Install into a Steam-clean 1.19.0.6 binaries directory.",
      "operation": "install",
      "initial": {
        "target_root_kind": "fixture_binaries",
        "classification_hint": "known_clean",
        "ck3_running": false,
        "target_is_reparse": false,
        "ancestor_is_reparse": false,
        "files": [
          {
            "relative_path": "ck3.exe",
            "kind": "file",
            "sha256": "2d00ff3101ef70b566f2fcbae292f09263199c80e9dc8f139b82d7d96f83db86",
            "size_bytes": 95206008,
            "owner": "steam"
          },
          {
            "relative_path": "dxcompiler.dll",
            "kind": "file",
            "sha256": "40e381d1d0ccf3bd725e30914b07d3d0cdaa907900e4d194da0e9cbd41d06e65",
            "size_bytes": 20291584,
            "owner": "steam"
          }
        ],
        "state_file": "absent"
      },
      "confirmation_response": null,
      "expected": {
        "classification": "known_clean",
        "decision": "proceed",
        "next_state": "managed_agp",
        "writes": [
          {
            "relative_path": "dxcompiler_original.dll",
            "action": "rename_from_dxcompiler"
          },
          {
            "relative_path": "dxcompiler.dll",
            "action": "replace"
          },
          {
            "relative_path": "AGP Native Hook/agp_parenthook.dll",
            "action": "create"
          },
          {
            "relative_path": "AGP Native Hook/agp-install-state.json",
            "action": "create"
          }
        ],
        "preserves": [
          {
            "relative_path": "ck3.exe",
            "action": "preserve"
          }
        ],
        "quarantines": [],
        "removes": [],
        "rollback": {
          "required": true,
          "committed_state": false,
          "restores": [
            "dxcompiler.dll",
            "dxcompiler_original.dll"
          ]
        },
        "reason": "The active Steam compiler is renamed transactionally to the canonical original path before the AGP proxy is written."
      }
    },
    {
      "id": "managed-in-place-upgrade",
      "description": "Upgrade an existing schema-v1 AGP install only after the typed in-place confirmation.",
      "operation": "install",
      "initial": {
        "target_root_kind": "fixture_binaries",
        "classification_hint": "managed_agp",
        "ck3_running": false,
        "target_is_reparse": false,
        "ancestor_is_reparse": false,
        "files": [
          {
            "relative_path": "ck3.exe",
            "kind": "file",
            "sha256": "2d00ff3101ef70b566f2fcbae292f09263199c80e9dc8f139b82d7d96f83db86",
            "size_bytes": 95206008,
            "owner": "steam"
          },
          {
            "relative_path": "dxcompiler.dll",
            "kind": "file",
            "sha256": "9a772457da46608dc0e05a6881318cc9663d94cd91513ece0861ae55b8ca6b5d",
            "size_bytes": 108032,
            "owner": "agp_managed"
          },
          {
            "relative_path": "dxcompiler_original.dll",
            "kind": "file",
            "sha256": "40e381d1d0ccf3bd725e30914b07d3d0cdaa907900e4d194da0e9cbd41d06e65",
            "size_bytes": 20291584,
            "owner": "steam"
          },
          {
            "relative_path": "AGP Native Hook/agp_parenthook.dll",
            "kind": "file",
            "sha256": "9191782a7525e3cc3de18c666f5d7494740ae36ee255829cf1105641a94723ed",
            "size_bytes": 134656,
            "owner": "agp_managed"
          },
          {
            "relative_path": "AGP Native Hook/agp-install-state.json",
            "kind": "file",
            "sha256": "ffffffffffffffffffffffffffffffffffffffffffffffffffffffffffffffff",
            "size_bytes": 1900,
            "owner": "agp_managed"
          }
        ],
        "state_file": "valid"
      },
      "confirmation_response": "UPGRADE_AGP_IN_PLACE",
      "expected": {
        "classification": "managed_agp",
        "decision": "proceed",
        "next_state": "managed_agp",
        "writes": [
          {
            "relative_path": "dxcompiler.dll",
            "action": "replace"
          },
          {
            "relative_path": "AGP Native Hook/agp_parenthook.dll",
            "action": "replace"
          },
          {
            "relative_path": "AGP Native Hook/agp-install-state.json",
            "action": "replace"
          }
        ],
        "preserves": [
          {
            "relative_path": "dxcompiler_original.dll",
            "action": "preserve"
          }
        ],
        "quarantines": [],
        "removes": [],
        "rollback": {
          "required": true,
          "committed_state": false,
          "restores": [
            "dxcompiler.dll",
            "AGP Native Hook/agp_parenthook.dll",
            "AGP Native Hook/agp-install-state.json"
          ]
        },
        "reason": "A valid state proves ownership; only state-owned files may be replaced after confirmation."
      }
    },
    {
      "id": "legacy-agp-prompts-and-aborts",
      "description": "A known manual/legacy AGP layout must not be changed when the user declines the upgrade prompt.",
      "operation": "install",
      "initial": {
        "target_root_kind": "fixture_binaries",
        "classification_hint": "legacy_agp",
        "ck3_running": false,
        "target_is_reparse": false,
        "ancestor_is_reparse": false,
        "files": [
          {
            "relative_path": "dxcompiler.dll",
            "kind": "file",
            "sha256": "7902c42b07581f90aebf94910553849aa8deeeaa07908df8f15b01e3250d09fc",
            "size_bytes": 135168,
            "owner": "unknown"
          },
          {
            "relative_path": "dxcompiler_original.dll",
            "kind": "file",
            "sha256": "40e381d1d0ccf3bd725e30914b07d3d0cdaa907900e4d194da0e9cbd41d06e65",
            "size_bytes": 20291584,
            "owner": "steam"
          },
          {
            "relative_path": "AGP Native Hook/agp_parenthook.dll",
            "kind": "file",
            "sha256": "9191782a7525e3cc3de18c666f5d7494740ae36ee255829cf1105641a94723ed",
            "size_bytes": 134656,
            "owner": "unknown"
          }
        ],
        "state_file": "absent"
      },
      "confirmation_response": null,
      "expected": {
        "classification": "legacy_agp",
        "decision": "abort",
        "next_state": "legacy_agp",
        "writes": [],
        "preserves": [
          {
            "relative_path": "dxcompiler.dll",
            "action": "preserve"
          },
          {
            "relative_path": "AGP Native Hook/agp_parenthook.dll",
            "action": "preserve"
          }
        ],
        "quarantines": [],
        "removes": [],
        "rollback": {
          "required": false,
          "committed_state": false,
          "restores": []
        },
        "reason": "Legacy AGP is recognized but ownership is not persisted; declining the prompt is a zero-write abort."
      }
    },
    {
      "id": "legacy-agp-confirmed-upgrade",
      "description": "A recognized legacy AGP layout can be converted after the typed in-place confirmation.",
      "operation": "install",
      "initial": {
        "target_root_kind": "fixture_binaries",
        "classification_hint": "legacy_agp",
        "ck3_running": false,
        "target_is_reparse": false,
        "ancestor_is_reparse": false,
        "files": [
          {
            "relative_path": "dxcompiler.dll",
            "kind": "file",
            "sha256": "7902c42b07581f90aebf94910553849aa8deeeaa07908df8f15b01e3250d09fc",
            "size_bytes": 135168,
            "owner": "unknown"
          },
          {
            "relative_path": "dxcompiler_original.dll",
            "kind": "file",
            "sha256": "40e381d1d0ccf3bd725e30914b07d3d0cdaa907900e4d194da0e9cbd41d06e65",
            "size_bytes": 20291584,
            "owner": "steam"
          },
          {
            "relative_path": "AGP Native Hook/agp_parenthook.dll",
            "kind": "file",
            "sha256": "9191782a7525e3cc3de18c666f5d7494740ae36ee255829cf1105641a94723ed",
            "size_bytes": 134656,
            "owner": "unknown"
          }
        ],
        "state_file": "absent"
      },
      "confirmation_response": "UPGRADE_AGP_IN_PLACE",
      "expected": {
        "classification": "legacy_agp",
        "decision": "proceed",
        "next_state": "managed_agp",
        "writes": [
          {
            "relative_path": "dxcompiler.dll",
            "action": "replace"
          },
          {
            "relative_path": "AGP Native Hook/agp_parenthook.dll",
            "action": "replace"
          },
          {
            "relative_path": "AGP Native Hook/agp-install-state.json",
            "action": "create"
          }
        ],
        "preserves": [
          {
            "relative_path": "dxcompiler_original.dll",
            "action": "preserve"
          }
        ],
        "quarantines": [
          {
            "relative_path": "dxcompiler.dll",
            "action": "quarantine"
          },
          {
            "relative_path": "AGP Native Hook/agp_parenthook.dll",
            "action": "quarantine"
          }
        ],
        "removes": [],
        "rollback": {
          "required": true,
          "committed_state": false,
          "restores": [